title,Unnamed: 0,Desc,Unnamed: 0.1,author,genre,image_link,rating,bookID,authors,average_rating,isbn,isbn13,language_code,  num_pages,ratings_count,text_reviews_count,publication_date,publisher,Unnamed: 12
Foucault's Pendulum,1712,"Foucault's Pendulum is divided into ten segments represented by the ten Sefiroth. The novel is full of esoteric references to the Kabbalah. The title of the book refers to an actual pendulum designed by the French physicist Léon Foucault to demonstrate the rotation of the earth, which has symbolic significance within the novel.Bored with their work, and after reading too many manuscripts about occult conspiracy theories, three vanity publisher employees (Belbo, Diotallevi and Casaubon) invent their own conspiracy for fun. They call this satirical intellectual game ""The Plan,"" a hoax that connects the medieval Knights Templar with other occult groups from ancient to modern times. This produces a map indicating the geographical point from which all the powers of the earth can be controlled—a point located in Paris, France, at Foucault’s Pendulum. But in a fateful turn the joke becomes all too real.The three become increasingly obsessed with The Plan, and sometimes forget that it's just a game. Worse still, other conspiracy theorists learn about The Plan, and take it seriously. Belbo finds himself the target of a real secret society that believes he possesses the key to the lost treasure of the Knights Templar.Orchestrating these and other diverse characters into his multilayered semiotic adventure, Eco has created a superb cerebral entertainment.",,Umberto Eco,Non-Fiction,https://i.gr-assets.com/images/S/compressed.photo.goodreads.com/books/1396645125l/17841.jpg,3.89,17841,Umberto Eco/William Weaver,3.89,015603297X,9.78E+12,eng,623,46598,2074,03-05-2007,Mariner Books,
Fragile Things: Short Fictions and Wonders,2131,"This is a stunning collection of short stories by acclaimed fantasy writer Neil Gaiman. His distinctive genius has been championed by writers as diverse as Norman Mailer and Stephen King. With The Sandman Neil Gaiman created one of the most sophisticated, intelligent, and influential graphic novel series of our time. Now after the recent success of his latest novel Anansi Boys, Gaiman has produced Fragile Things, his second collection of short fiction. These stories will dazzle your senses, haunt your imagination, and move you to the very depths of your soul. This extraordinary compilation reveals one of the world's most gifted storytellers at the height of his powers.",,Neil Gaiman,Non-Fiction,https://i.gr-assets.com/images/S/compressed.photo.goodreads.com/books/1386924550l/16788.jpg,4,16788,Neil Gaiman,4,60515228,9.78E+12,eng,360,45473,2540,9/26/2006,William Morrow,
Frankenstein,1246,"Mary Shelley began writing Frankenstein when she was only eighteen. At once a Gothic thriller, a passionate romance, and a cautionary tale about the dangers of science, Frankenstein tells the story of committed science student Victor Frankenstein. Obsessed with discovering the cause of generation and life and bestowing animation upon lifeless matter, Frankenstein assembles a human being from stolen body parts but; upon bringing it to life, he recoils in horror at the creature's hideousness. Tormented by isolation and loneliness, the once-innocent creature turns to evil and unleashes a campaign of murderous revenge against his creator, Frankenstein.Frankenstein, an instant bestseller and an important ancestor of both the horror and science fiction genres, not only tells a terrifying story, but also raises profound, disturbing questions about the very nature of life and the place of humankind within the cosmos: What does it mean to be human? What responsibilities do we have to each other? How far can we go in tampering with Nature? In our age, filled with news of organ donation genetic engineering, and bio-terrorism, these questions are more relevant than ever.",,Mary Wollstonecraft Shelley,Non-Fiction,https://i.gr-assets.com/images/S/compressed.photo.goodreads.com/books/1498841231l/35031085.jpg,3.8,18489,Mary Wollstonecraft Shelley/J. Paul Hunter,3.79,393964582,9.78E+12,en-US,336,2188,171,12/17/1995,W. W. Norton & Company,
Franny and Zooey,1567,"The short story, Franny, takes place in an unnamed college town and tells the tale of an undergraduate who is becoming disenchanted with the selfishness and inauthenticity she perceives all around her.The novella, Zooey, is named for Zooey Glass, the second-youngest member of the Glass family. As his younger sister, Franny, suffers a spiritual and existential breakdown in her parents' Manhattan living room -- leaving Bessie, her mother, deeply concerned -- Zooey comes to her aid, offering what he thinks is brotherly love, understanding, and words of sage advice.Salinger writes of these works: ""FRANNY came out in The New Yorker in 1955, and was swiftly followed, in 1957 by ZOOEY. Both stories are early, critical entries in a narrative series I'm doing about a family of settlers in twentieth-century New York, the Glasses. It is a long-term project, patently an ambiguous one, and there is a real-enough danger, I suppose that sooner or later I'll bog down, perhaps disappear entirely, in my own methods, locutions, and mannerisms. On the whole, though, I'm very hopeful. I love working on these Glass stories, I've been waiting for them most of my life, and I think I have fairly decent, monomaniacal plans to finish them with due care and all-available skill.""",,J.D. Salinger,Non-Fiction,https://i.gr-assets.com/images/S/compressed.photo.goodreads.com/books/1355037988l/5113.jpg,3.98,5113,J.D. Salinger,3.98,316769029,9.78E+12,eng,201,167157,4994,1/30/2001,Back Bay Books,
Freakonomics: A Rogue Economist Explores the Hidden Side of Everything,561,"Which is more dangerous, a gun or a swimming pool? What do schoolteachers and sumo wrestlers have in common? Why do drug dealers still live with their moms? How much do parents really matter? What kind of impact did Roe v. Wade have on violent crime? Freakonomics will literally redefine the way we view the modern world.These may not sound like typical questions for an economist to ask. But Steven D. Levitt is not a typical economist. He is a much heralded scholar who studies the stuff and riddles of everyday life -- from cheating and crime to sports and child rearing -- and whose conclusions regularly turn the conventional wisdom on its head. He usually begins with a mountain of data and a simple, unasked question. Some of these questions concern life-and-death issues; others have an admittedly freakish quality. Thus the new field of study contained in this book: freakonomics.Through forceful storytelling and wry insight, Levitt and co-author Stephen J. Dubner show that economics is, at root, the study of incentives -- how people get what they want, or need, especially when other people want or need the same thing. In Freakonomics, they set out to explore the hidden side of ... well, everything. The inner workings of a crack gang. The truth about real-estate agents. The myths of campaign finance. The telltale marks of a cheating schoolteacher. The secrets of the Ku Klux Klan.What unites all these stories is a belief that the modern world, despite a surfeit of obfuscation, complication, and downright deceit, is not impenetrable, is not unknowable, and -- if the right questions are asked -- is even more intriguing than we think. All it takes is a new way of looking. Steven Levitt, through devilishly clever and clear-eyed thinking, shows how to see through all the clutter.Freakonomics establishes this unconventional premise: If morality represents how we would like the world to work, then economics represents how it actually does work. It is true that readers of this book will be armed with enough riddles and stories to last a thousand cocktail parties. But Freakonomics can provide more than that. It will literally redefine the way we view the modern world.(front flap)",562,Steven D. Levitt,Business,https://i.gr-assets.com/images/S/compressed.photo.goodreads.com/books/1550917827l/1202._SX318_.jpg,3.97,1202,Steven D. Levitt/Stephen J. Dubner,3.97,61234001,9.78E+12,eng,320,628745,13034,10/17/2006,William Morrow,
Galápagos,1952,"Galápagos takes the reader back one million years, to A.D. 1986. A simple vacation cruise suddenly becomes an evolutionary journey. Thanks to an apocalypse, a small group of survivors stranded on the Galápagos Islands are about to become the progenitors of a brave, new, and totally different human race. In this inimitable novel, America’s master satirist looks at our world and shows us all that is sadly, madly awry—and all that is worth saving.",,Kurt Vonnegut Jr.,Non-Fiction,https://i.gr-assets.com/images/S/compressed.photo.goodreads.com/books/1355012643l/9593.jpg,3.88,9593,Kurt Vonnegut Jr.,3.88,385333870,9.78E+12,eng,324,55850,1990,01-12-1999,Dial Press,
Geek Love,1913,"Geek Love is the story of the Binewskis, a carny family whose mater- and paterfamilias set out—with the help of amphetamine, arsenic, and radioisotopes—to breed their own exhibit of human oddities. There’s Arturo the Aquaboy, who has flippers for limbs and a megalomaniac ambition worthy of Genghis Khan . . . Iphy and Elly, the lissome Siamese twins . . . albino hunchback Oly, and the outwardly normal Chick, whose mysterious gifts make him the family’s most precious—and dangerous—asset.As the Binewskis take their act across the backwaters of the U.S., inspiring fanatical devotion and murderous revulsion; as its members conduct their own Machiavellian version of sibling rivalry, Geek Love throws its sulfurous light on our notions of the freakish and the normal, the beautiful and the ugly, the holy and the obscene. Family values will never be the same.",,Katherine Dunn,Non-Fiction,https://i.gr-assets.com/images/S/compressed.photo.goodreads.com/books/1366699063l/13872.jpg,3.97,13872,Katherine Dunn,3.97,375713344,9.78E+12,eng,348,50103,5030,06-11-2002,Random House Vintage,
Getting Things Done: The Art of Stress-Free Productivity,568,"In today's world, yesterday's methods just don't work. In Getting Things Done, veteran coach and management consultant David Allen shares the breakthrough methods for stress-free performance that he has introduced to tens of thousands of people across the country. Allen's premise is simple: our productivity is directly proportional to our ability to relax. Only when our minds are clear and our thoughts are organized can we achieve effective productivity and unleash our creative potential. In Getting Things Done Allen shows how to:* Apply the ""do it, delegate it, defer it, drop it"" rule to get your in-box to empty* Reassess goals and stay focused in changing situations* Plan projects as well as get them unstuck* Overcome feelings of confusion, anxiety, and being overwhelmed* Feel fine about what you're not doingFrom core principles to proven tricks, Getting Things Done can transform the way you work, showing you how to pick up the pace without wearing yourself down.",569,David Allen,Business,https://i.gr-assets.com/images/S/compressed.photo.goodreads.com/books/1312474060l/1633.jpg,3.99,1633,David    Allen,3.99,142000280,9.78E+12,en-GB,267,105507,3838,12/31/2002,Penguin Books,
Girl with a Pearl Earring,1510,"With precisely 35 canvases to his credit, the Dutch painter Johannes Vermeer represents one of the great enigmas of 17th-century art. The meager facts of his biography have been gleaned from a handful of legal documents. Yet Vermeer's extraordinary paintings of domestic life, with their subtle play of light and texture, have come to define the Dutch golden age. His portrait of the anonymous Girl with a Pearl Earring has exerted a particular fascination for centuries - and it is this magnetic painting that lies at the heart of Tracy Chevalier's second novel of the same title.Girl with a Pearl Earring centers on Vermeer's prosperous Delft household during the 1660s. When Griet, the novel's quietly perceptive heroine, is hired as a servant, turmoil follows. First, the 16-year-old narrator becomes increasingly intimate with her master. Then Vermeer employs her as his assistant--and ultimately has Griet sit for him as a model.",,Tracy Chevalier,Non-Fiction,https://i.gr-assets.com/images/S/compressed.photo.goodreads.com/books/1327197580l/2865.jpg,3.88,2864,Tracy Chevalier,3.88,452284937,9.78E+12,eng,233,1162,127,9/30/2003,Plume Books,
Gone with the Wind,1388,"Librarian Note: There is more than one author in the Goodreads database with this name. Margaret Munnerlyn Mitchell, popularly known as Margaret Mitchell, was an American author, who won the Pulitzer Prize in 1937 for her novel, Gone with the Wind, published in 1936. The novel is one of the most popular books of all time, selling more than 28 million copies. An American film adaptation, released",,Margaret Mitchell,Non-Fiction,https://i.gr-assets.com/images/S/compressed.photo.goodreads.com/books/1551144577l/18405._SY475_.jpg,4.29,18405,Margaret Mitchell,4.29,446675539,9.78E+12,eng,1037,999139,15323,04-01-1999,Warner Books,
Gravity's Rainbow,1889,"Thomas Ruggles Pynchon, Jr. is an American writer based in New York City, noted for his dense and complex works of fiction. Hailing from Long Island, Pynchon spent two years in the United States Navy and earned an English degree from Cornell University. After publishing several short stories in the late 1950s and early 1960s, he began composing the novels for which he is best known today: V.",,Thomas Pynchon,Non-Fiction,https://i.gr-assets.com/images/S/compressed.photo.goodreads.com/books/1414969925l/415.jpg,4.01,412,Thomas Pynchon,4.01,140283382,9.78E+12,eng,784,762,213,01-01-2000,Penguin Books,
Great Expectations,1340,"In what may be Dickens's best novel, humble, orphaned Pip is apprenticed to the dirty work of the forge but dares to dream of becoming a gentleman — and one day, under sudden and enigmatic circumstances, he finds himself in possession of ""great expectations."" In this gripping tale of crime and guilt, revenge and reward, the compelling characters include Magwitch, the fearful and fearsome convict; Estella, whose beauty is excelled only by her haughtiness; and the embittered Miss Havisham, an eccentric jilted bride.",,Charles Dickens,Non-Fiction,https://i.gr-assets.com/images/S/compressed.photo.goodreads.com/books/1327920219l/2623.jpg,3.77,2619,Charles Dickens/David Trotter/Charlotte Mitchell,3.77,141439564,9.78E+12,eng,512,14228,668,12/31/2002,Penguin Books,
Gulliver's Travels,1517,"
'I felt something alive moving on my left leg ... when bending my Eyes downwards as much as I could. I perceived it to be a human Creature not six inches high'
Shipwrecked and cast adrift, Lemuel Gulliver wakes to find himself on Lilliput, an island inhabited by little people, whose height makes their quarrels over fashion and fame seem ridiculous. His subsequent encounters - with the crude giants of Brobdingnag, the philosophical Houyhnhnms and the brutish Yahoos - give Gulliver new, bitter insights into human behaviour. Swift's savage satire view mankind in a distorted hall of mirrors as a diminished, magnified and finally bestial species, presenting us with an uncompromising reflection of ourselves.This text, based on the first edition of 1726, reproduces all its original illustrations and includes an introduction by Robert Demaria, Jr, which discusses the ways Gulliver's Travels has been interpreted since its first publication.",,Jonathan Swift,Non-Fiction,https://i.gr-assets.com/images/S/compressed.photo.goodreads.com/books/1427829692l/7733.jpg,3.57,7733,Jonathan Swift/Robert DeMaria Jr.,3.57,141439491,9.78E+12,eng,306,194738,3485,1/30/2003,Penguin,
Hackers & Painters: Big Ideas from the Computer Age,1105,"The bestselling author of phenomenally successful and continually vital The E-Myth Revisited presents the next big step in entrepreneurial management and leadership with E-Myth Mastery.A practical, real-world program that is implemented real-time into your business, Gerber begins by engaging the reader in understanding why the entrepreneur is so critical to the success of any enterprise, no matter how small or large it may be, and why the mindset of an entrepreneur is so integral to the operating reality of the organization, of the small business, and the enterprise. He then covers seven essential skills:LeadershipMarketingMoneyManagementLead ConversionLead GenerationClient FulfilmentEach of these seven skills is presented through a specific training module with corresponding tests and exercises that explain the content and principles to be learned, provide case studies and examples, as well as worksheets for applying those ideas to the business. Gerber ties it all together by helping readers put the pieces together in an E-Myth Business, an E-Myth Practice and an E-Myth Enterprise.This is the book that will show you the difference between being an entrepreneur versus doing a job, how to get money when the bank won't give it to you, how to expand your customer base when big business moves in down the street, how to develop the best people when you can't afford to pay them competitive wages, how to increase the predictability of what your business is able to promise, and then how to keep that promise, every single time, no matter where you are or what you're doing.Mastery is a business development program that helps you turn your company into a world-class operation...into a turn-key money machine!",1106,Paul Graham,Business,https://i.gr-assets.com/images/S/compressed.photo.goodreads.com/books/1348562702l/41793.jpg,4.05,41793,Paul Graham/Allen Noren/Matt Hutchinson,4.05,596006624,9.78E+12,eng,272,6572,302,5/25/2004,O'Reilly Media,
Half of a Yellow Sun,1717,"A masterly, haunting new novel from a writer heralded by The Washington Post Book World as “the 21st-century daughter of Chinua Achebe,” Half of a Yellow Sun re-creates a seminal moment in modern African history: Biafra’s impassioned struggle to establish an independent republic in Nigeria in the 1960s, and the chilling violence that followed. With astonishing empathy and the effortless grace of a natural storyteller, Chimamanda Ngozi Adichie weaves together the lives of three characters swept up in the turbulence of the decade. Thirteen-year-old Ugwu is employed as a houseboy for a university professor full of revolutionary zeal. Olanna is the professor’s beautiful mistress, who has abandoned her life of privilege in Lagos for a dusty university town and the charisma of her new lover. And Richard is a shy young Englishman in thrall to Olanna’s twin sister, an enigmatic figure who refuses to belong to anyone. As Nigerian troops advance and the three must run for their lives, their ideals are severely tested, as are their loyalties to one another. Epic, ambitious, and triumphantly realized, Half of a Yellow Sun is a remarkable novel about moral responsibility, about the end of colonialism, about ethnic allegiances, about class and race—and the ways in which love can complicate them all. Adichie brilliantly evokes the promise and the devastating disappointments that marked this time and place, bringing us one of the most powerful, dramatic, and intensely emotional pictures of modern Africa that we have ever had.",,Chimamanda Ngozi Adichie,Non-Fiction,https://i.gr-assets.com/images/S/compressed.photo.goodreads.com/books/1327934717l/18749.jpg,4.32,18749,Chimamanda Ngozi Adichie,4.32,1400044162,9.78E+12,eng,433,71280,5494,09-12-2006,Knopf,
Ham on Rye,2281,"In what is widely hailed as the best of his many novels, Charles Bukowski details the long, lonely years of his own hardscrabble youth in the raw voice of alter ego Henry Chinaski. From a harrowingly cheerless childhood in Germany through acne-riddled high school years and his adolescent discoveries of alcohol, women, and the Los Angeles Public Library's collection of D. H. Lawrence, ""Ham on Rye"" offers a crude, brutal, and savagely funny portrait of an outcast's coming-of-age during the desperate days of the Great Depression.",,Charles Bukowski,Non-Fiction,https://i.gr-assets.com/images/S/compressed.photo.goodreads.com/books/1388195001l/38501.jpg,4.14,38501,Charles Bukowski,4.14,006117758X,9.78E+12,eng,288,65829,2318,7/29/2014,Ecco,
Hamlet,1459,"Among Shakespeare's plays, ""Hamlet"" is considered by many his masterpiece. Among actors, the role of Hamlet, Prince of Denmark, is considered the jewel in the crown of a triumphant theatrical career. Now Kenneth Branagh plays the leading role and co-directs a brillant ensemble performance. Three generations of legendary leading actors, many of whom first assembled for the Oscar-winning film ""Henry V"", gather here to perform the rarely heard complete version of the play. This clear, subtly nuanced, stunning dramatization, presented by The Renaissance Theatre Company in association with ""Bbc"" Broadcasting, features such luminaries as Sir John Gielgud, Derek Jacobi, Emma Thompson and Christopher Ravenscroft. It combines a full cast with stirring music and sound effects to bring this magnificent Shakespearen classic vividly to life. Revealing new riches with each listening, this production of ""Hamlet"" is an invaluable aid for students, teachers and all true lovers of Shakespeare - a recording to be treasured for decades to come.",,William Shakespeare,Non-Fiction,https://i.gr-assets.com/images/S/compressed.photo.goodreads.com/books/1351051208l/1420.jpg,4.02,1420,William Shakespeare/Harold Bloom/Rex Gibson,4.02,521618746,9.78E+12,eng,289,609271,7139,08-01-2005,Cambridge University Press,
Hannibal,2113,"Years after his escape, posing as scholarly Dr. Fell, curator of a grand family's palazzo, Hannibal lives the good life in Florence, playing lovely tunes by serial killer/composer Henry VIII and killing hardly anyone himself. Clarice is unluckier: in the novel's action-film-like opening scene, she survives an FBI shootout gone wrong, and her nemesis, Paul Krendler, makes her the fall guy. Clarice is suspended, so, unfortunately, the first cop who stumbles on Hannibal is an Italian named Pazzi, who takes after his ancestors, greedy betrayers depicted in Dante's Inferno. Pazzi is on the take from a character as scary as Hannibal: Mason Verger. When Verger was a young man busted for raping children, his vast wealth saved him from jail. All he needed was psychotherapy--with Dr. Lecter. Thanks to the treatment, Verger is now on a respirator, paralyzed except for one crablike hand, watching his enormous, brutal moray eel swim figure eights and devour fish. His obsession is to feed Lecter to some other brutal pets.",,Thomas Harris,Non-Fiction,https://i.gr-assets.com/images/S/compressed.photo.goodreads.com/books/1327356556l/32418.jpg,3.76,40004,Theodore Ayrault Dodge/Ian M. Cuthbertson,4.13,076076896X,9.78E+12,eng,592,19,2,7/16/2005,Barnes  Noble,
Hard Drive: Bill Gates and the Making of the Microsoft Empire,412,"In The Partnership Charter, psychologist and business mediation expert David Gage offers a comprehensive guide to the art of establishing and maintaining a business partnership. The centerpiece of his approach is the Partnership Charter, a document that clearly outlines the goals, expectations, responsibilities, and relationships of the principals. The charter identifies potential sources of conflict and how they will be resolved, while addressing such sensitive issues as personal styles, values, money, and power. Illustrating every principle through engaging stories drawn from Gage's front-line experience consulting to business partners, as well as interviews with the founding partners of such successful businesses as Progressive Insurance Company and Manpower, Inc., The Partnership Charter dispels common myths and presents a practical framework for launching, building, and sustaining a thriving business partnership.",412,James Wallace,Business,https://i.gr-assets.com/images/S/compressed.photo.goodreads.com/books/1440431674l/41611._SY475_.jpg,4.11,41611,James Wallace/Jim  Erickson,4.11,887306292,9.78E+12,en-US,426,1234,41,3/26/1993,HarperCollins,
Hard Times,2169,"""My satire is against those who see figures and averages, and nothing else,"" proclaimed Charles Dickens in explaining the theme of this classic novel. Published in 1854, the story concerns one Thomas Gradgrind, a ""fanatic of the demonstrable fact,"" who raises his children, Tom and Louisa, in a stifling and arid atmosphere of grim practicality.Without a moral compass to guide them, the children sink into lives of desperation and despair, played out against the grim background of Coketown, a wretched community shadowed by an industrial behemoth. Louisa falls into a loveless marriage with Josiah Bouderby, a vulgar banker, while the unscrupulous Tom, totally lacking in principle, becomes a thief who frames an innocent man for his crime. Witnessing the degradation and downfall of his children, Gradgrind realizes that his own misguided principles have ruined their lives.Considered Dickens' harshest indictment of mid-19th-century industrial practices and their dehumanizing effects, this novel offers a fascinating tapestry of Victorian life, filled with the richness of detail, brilliant characterization, and passionate social concern that typify the novelist's finest creations.Of Dickens' work, the eminent Victorian critic John Ruskin had this to say: ""He is entirely right in his main drift and purpose in every book he has written; and all of them, but especially Hard Times, should be studied with close and earnest care by persons interested in social questions.""",,Charles Dickens,Non-Fiction,https://i.gr-assets.com/images/S/compressed.photo.goodreads.com/books/1348651243l/5344.jpg,3.52,5344,Charles Dickens,3.52,321107217,9.78E+12,eng,353,41041,1706,10/19/2003,Pearson Longman,
