title,Unnamed: 0,Desc,Unnamed: 0.1,author,genre,image_link,rating,bookID,authors,average_rating,isbn,isbn13,language_code,  num_pages,ratings_count,text_reviews_count,publication_date,publisher,Unnamed: 12
The Illustrated Man,2210,"That The Illustrated Man has remained in print since being published in 1951 is fair testimony to the universal appeal of Ray Bradbury's work. Only his second collection (the first was Dark Carnival, later reworked into The October Country), it is a marvelous, if mostly dark, quilt of science fiction, fantasy, and horror. In an ingenious framework to open and close the book, Bradbury presents himself as a nameless narrator who meets the Illustrated Man--a wanderer whose entire body is a living canvas of exotic tattoos. What's even more remarkable, and increasingly disturbing, is that the illustrations are themselves magically alive, and each proceeds to unfold its own story, such as ""The Veldt,"" wherein rowdy children take a game of virtual reality way over the edge. Or ""Kaleidoscope,"" a heartbreaking portrait of stranded astronauts about to reenter our atmosphere--without the benefit of a spaceship. Or ""Zero Hour,"" in which invading aliens have discovered a most logical ally--our own children. Even though most were written in the 1940s and 1950s, these 18 classic stories will be just as chillingly effective 50 years from now. --Stanley WiaterContents:· Prologue: The Illustrated Man · ss * · The Veldt [“The World the Children Made”] · ss The Saturday Evening Post Sep 23 ’50 · Kaleidoscope · ss Thrilling Wonder Stories Oct ’49 · The Other Foot · ss New Story Magazine Mar ’51 · The Highway [as by Leonard Spalding] · ss Copy Spr ’50 · The Man · ss Thrilling Wonder Stories Feb ’49 · The Long Rain [“Death-by-Rain”] · ss Planet Stories Sum ’50 · The Rocket Man · ss Maclean’s Mar 1 ’51 · The Fire Balloons [“‘In This Sign...’”] · ss Imagination Apr ’51 · The Last Night of the World · ss Esquire Feb ’51 · The Exiles [“The Mad Wizards of Mars”] · ss Maclean’s Sep 15 ’49; F&SF Win ’50 · No Particular Night or Morning · ss * · The Fox and the Forest [“To the Future”] · ss Colliers May 13 ’50 · The Visitor · ss Startling Stories Nov ’48 · The Concrete Mixer · ss Thrilling Wonder Stories Apr ’49 · Marionettes, Inc. [Marionettes, Inc.] · ss Startling Stories Mar ’49 · The City [“Purpose”] · ss Startling Stories Jul ’50 · Zero Hour · ss Planet Stories Fll ’47 · The Rocket [“Outcast of the Stars”] · ss Super Science Stories Mar ’50 · Epilogue · aw *",,Ray Bradbury,Non-Fiction,https://i.gr-assets.com/images/S/compressed.photo.goodreads.com/books/1374049820l/24830.jpg,4.14,24832,Ray Bradbury,4.14,553105574,9.78E+12,eng,186,89,7,01-01-1976,Bantam Books,
The Innovator's Dilemma: The Revolutionary Book that Will Change the Way You Do Business,563,"Harvard professor Clayton M. Christensen says outstanding companies can do everything right and still lose their market leadership -- or worse, disappear completely. And he not only proves what he says, he tells others how to avoid a similar fate.Focusing on ""disruptive technology"" -- the Honda Super Cub, Intel's 8088 processor, or the hydraulic excavator, for example -- Christensen shows why most companies miss ""the next great wave."" Whether in electronics or retailing, a successful company with established products will get pushed aside unless managers know when to abandon traditional business practices. Using the lessons of successes and failures from leading companies, ""The Innovator's Dilemma"" presents a set of rules for capitalizing on the phenomenon of disruptive innovation.",564,Clayton M. Christensen,Business,https://i.gr-assets.com/images/S/compressed.photo.goodreads.com/books/1347654027l/2615.jpg,3.99,2615,Clayton M. Christensen/L.J. Ganser,3.99,60521996,9.78E+12,eng,286,32079,752,01-07-2003,Harper Paperbacks,
The Invisible Man,1808,"Herbert George Wells was born to a working class family in Kent, England. Young Wells received a spotty education, interrupted by several illnesses and family difficulties, and became a draper's apprentice as a teenager. The headmaster of Midhurst Grammar School, where he had spent a year, arranged for him to return as an ""usher,"" or student teacher. Wells earned a government scholarship in 1884,",,H.G. Wells,Non-Fiction,https://i.gr-assets.com/images/S/compressed.photo.goodreads.com/books/1388639080l/17184.jpg,3.64,8919,H.G. Wells,3.64,439574277,9.78E+12,eng,208,333,23,09-01-2004,Scholastic Paperbacks,
The Island of Doctor Moreau,2014,"Ranked among the classic novels of the English language and the inspiration for several unforgettable movies, this early work of H. G. Wells was greeted in 1896 by howls of protest from reviewers, who found it horrifying and blasphemous. They wanted to know more about the wondrous possibilities of science shown in his first book, The Time Machine, not its potential for misuse and terror. In The Island of Dr. Moreau, a shipwrecked gentleman named Edward Prendick, stranded on a Pacific island lorded over by the notorious Dr. Moreau, confronts dark secrets, strange creatures, and a reason to run for his life.While this riveting tale was intended to be a commentary on evolution, divine creation, and the tension between human nature and culture, modern readers familiar with genetic engineering will marvel at Wells’s prediction of the ethical issues raised by producing “smarter” human beings or bringing back extinct species. These levels of interpretation add a richness to Prendick’s adventures on Dr. Moreau’s island of lost souls without distracting from what is still a rip-roaring good read.",,H.G. Wells,Non-Fiction,https://i.gr-assets.com/images/S/compressed.photo.goodreads.com/books/1388230211l/29981.jpg,3.73,29981,H.G. Wells,3.73,553214322,9.78E+12,eng,153,71933,2443,05-01-1994,Bantam Classics,
The Jane Austen Book Club,2130,"The Extraordinary New York Times Bestseller  In California's central valley, five women and one man join to discuss Jane Austen's novels. Over the six months they get together, marriages are tested, affairs begin, unsuitable arrangements become suitable, and love happens. With her eye for the frailties of human behavior and her ear for the absurdities of social intercourse, Karen Joy Fowler has never been wittier nor her characters more appealing. The result is a delicious dissection of modern relationships.  Dedicated Austenites will delight in unearthing the echoes of Austen that run through the novel, but most readers will simply enjoy the vision and voice that, despite two centuries of separation, unite two great writers of brilliant social comedy.",,Karen Joy Fowler,Non-Fiction,https://i.gr-assets.com/images/S/compressed.photo.goodreads.com/books/1309282966l/2152.jpg,3.08,2152,Karen Joy Fowler,3.08,452286530,9.78E+12,eng,288,57720,3535,4/26/2005,G.P. Putnam's Sons,
The Joy Luck Club,1367,"Four mothers, four daughters, four families, whose histories shift with the four winds depending on who's telling the stories. In 1949, four Chinese women, recent immigrants to San Francisco, meet weekly to play mahjong and tell stories of what they left behind in China. United in loss and new hope for their daughters' futures, they call themselves the Joy Luck Club. Their daughters, who have never heard these stories, think their mothers' advice is irrelevant to their modern American lives – until their own inner crises reveal how much they've unknowingly inherited of their mothers' pasts. With wit and sensitivity, Amy Tan examines the sometimes painful, often tender, and always deep connection between mothers and daughters. As each woman reveals her secrets, trying to unravel the truth about her life, the strings become more tangled, more entwined. Mothers boast or despair over daughters, and daughters roll their eyes even as they feel the inextricable tightening of their matriarchal ties. Tan is an astute storyteller, enticing readers to immerse themselves into these lives of complexity and mystery.",,Amy Tan,Non-Fiction,https://i.gr-assets.com/images/S/compressed.photo.goodreads.com/books/1304978653l/7763._SY475_.jpg,3.92,7763,Amy Tan,3.92,143038095,9.78E+12,eng,288,565524,7255,9/21/2006,Penguin Books,
The Jungle,1715,"For nearly a century, the original version of Upton Sinclair's classic novel has remained almost entirely unknown. When it was published in serial form in 1905, it was a full third longer than the censored, commercial edition published in book form the following year. That expurgated commercial edition edited out much of the ethnic flavor of the original, as well as some of the goriest descriptions of the meat-packing industry and much of Sinclair's most pointed social and political commentary. The text of this new edition is as it appeared in the original uncensored edition of 1905. It contains the full 36 chapters as originally published, rather than the 31 of the expurgated edition. A new foreword describes the discovery in the 1980s of the original edition and its subsequent suppression, and a new introduction places the novel in historical context by explaining the pattern of censorship in the shorter commercial edition.",,Upton Sinclair,Non-Fiction,https://i.gr-assets.com/images/S/compressed.photo.goodreads.com/books/1332140681l/41681.jpg,3.74,41681,Upton Sinclair/Earl Lee/Kathleen DeGrave,3.74,1884365302,9.78E+12,eng,335,110423,4133,04-01-2003,See Sharp Press,
The Killer Angels,2276,"In the four most bloody and courageous days of our nation's history, two armies fought for two dreams. One dreamed of freedom, the other of a way of life. Far more than rifles and bullets were carried into battle. There were memories. There were promises. There was love. And far more than men fell on those Pennsylvania fields. Shattered futures, forgotten innocence, and crippled beauty were also the casualties of war. The Killer Angels is unique, sweeping, unforgettable—a dramatic re-creation of the battleground for America's destiny.",,Michael Shaara,Non-Fiction,https://i.gr-assets.com/images/S/compressed.photo.goodreads.com/books/1355371689l/682804.jpg,4.32,44470,Michael Shaara/Stephen Hoye,4.32,739309056,9.78E+12,en-US,13,92,37,05-11-2004,Random House Audio Publishing Group,
The Kitchen God's Wife,2115,"Winnie and Helen have kept each other's worst secrets for more than fifty years. Now, because she believes she is dying, Helen wants to expose everything. And Winnie angrily determines that she must be the one to tell her daughter, Pearl, about the past—including the terrible truth even Helen does not know. And so begins Winnie's story of her life on a small island outside Shanghai in the 1920s, and other places in China during World War II, and traces the happy and desperate events that led to Winnie's coming to America in 1949.",,Amy Tan,Non-Fiction,https://i.gr-assets.com/images/S/compressed.photo.goodreads.com/books/1434152599l/12557._SY475_.jpg,4.01,12557,Amy Tan,4.01,143038109,9.78E+12,en-US,416,66503,1661,9/21/2006,Penguin Books,
The Last Juror,2320,"In 1970, one of Mississippi s more colorful weekly newspapers, The Ford County Times, went bankrupt. To the surprise and dismay of many, ownership was assumed by a 23-year-old college dropout, named Willie Traynor. The future of the paper looked grim until a young mother was brutally raped and murdered by a member of the notorious Padgitt family. Willie Traynor reported all the gruesome details, and his newspaper began to prosper.The murderer, Danny Padgitt, was tried before a packed courthouse in Clanton, Mississippi. The trial came to a startling and dramatic end when the defendant threatened revenge against the jurors if they convicted him. Nevertheless, they found him guilty, and he was sentenced to life in prison. But in Mississippi in 1970, life didn't necessarily mean life, and nine years later Danny Padgitt managed to get himself paroled. He returned to Ford County, and the retribution began.",,John Grisham,Non-Fiction,https://i.gr-assets.com/images/S/compressed.photo.goodreads.com/books/1386924294l/5346.jpg,3.87,5346,John Grisham,3.87,385339682,9.78E+12,eng,278,72294,1755,4/25/2006,Delta,
The Leadership Challenge,810,"I had to read this for work, which must qualify as some kind of cruel and unusual punishment. Anyway:The Leadership Challenge  A review in clichés and idioms.The Leadership Challenge describes itself as an evidence-based primer on the near-universal qualities of excellent leaders. Its authors state that they have conducted years of research on leadership, and have distilled the data into what they have identified as the five practices of successful leaders. Each of the five practices is then",811,James M. Kouzes,Business,https://i.gr-assets.com/images/S/compressed.photo.goodreads.com/books/1348267307l/1758199.jpg,4.05,1246,James M. Kouzes/Barry Z. Posner,4.05,787968331,9.78E+12,en-US,458,873,40,08-07-2003,Jossey-Bass,
The Little Friend,2381,"Bestselling author Donna Tartt returns with a grandly ambitious and utterly riveting novel of childhood, innocence and evil. The setting is Alexandria, Mississippi, where one Mother’s Day a little boy named Robin Cleve Dufresnes was found hanging from a tree in his parents’ yard. Twelve years later Robin’s murder is still unsolved and his family remains devastated. So it is that Robin’s sister Harriet - unnervingly bright, insufferably determined, and unduly influenced by the fiction of Kipling and Robert Louis Stevenson--sets out to unmask his killer. Aided only by her worshipful friend Hely, Harriet crosses her town’s rigid lines of race and caste and burrows deep into her family’s history of loss.",,Donna Tartt,Non-Fiction,https://i.gr-assets.com/images/S/compressed.photo.goodreads.com/books/1327936589l/775346.jpg,3.46,14054,Donna Tartt,3.46,747573646,9.78E+12,eng,555,808,112,06-01-2007,Bloomsbury,
The Long Walk,2351,"This is a Stephen King pseudonym.At the beginning of Stephen King's career, the general view among publishers was that an author was limited to one book per year, since publishing more would be unacceptable to the public. King therefore wanted to write under another name, in order to increase his publication without over-saturating the market for the King ""brand"". He convinced his publisher,",,Richard Bachman,Non-Fiction,https://i.gr-assets.com/images/S/compressed.photo.goodreads.com/books/1309212400l/9014.jpg,4.11,9014,Richard Bachman/Stephen King,4.11,451196716,9.78E+12,eng,370,94303,4453,04-01-1999,Signet,
The Lord of the Rings,1410,"One Ring to rule them all, One Ring to find them, One Ring to bring them all and in the darkness bind themIn ancient times the Rings of Power were crafted by the Elven-smiths, and Sauron, the Dark Lord, forged the One Ring, filling it with his own power so that he could rule all others. But the One Ring was taken from him, and though he sought it throughout Middle-earth, it remained lost to him. After many ages it fell by chance into the hands of the hobbit Bilbo Baggins.From Sauron's fastness in the Dark Tower of Mordor, his power spread far and wide. Sauron gathered all the Great Rings to him, but always he searched for the One Ring that would complete his dominion.When Bilbo reached his eleventy-first birthday he disappeared, bequeathing to his young cousin Frodo the Ruling Ring and a perilous quest: to journey across Middle-earth, deep into the shadow of the Dark Lord, and destroy the Ring by casting it into the Cracks of Doom.The Lord of the Rings tells of the great quest undertaken by Frodo and the Fellowship of the Ring: Gandalf the Wizard; the hobbits Merry, Pippin, and Sam; Gimli the Dwarf; Legolas the Elf; Boromir of Gondor; and a tall, mysterious stranger called Strider.",,J.R.R. Tolkien,Non-Fiction,https://i.gr-assets.com/images/S/compressed.photo.goodreads.com/books/1566425108l/33.jpg,4.5,15369,J.R.R. Tolkien/Brian Sibley/Michael Bakewell/Stephen  Oliver/Ian Holm/Michael Hordern/Robert Stephens/John Le Mesurier/Peter Woodthorpe/Gerard  Murphy/Hugh Dickson/Peter Vaughan/Peter Howell,4.5,563494859,9.78E+12,eng,15,2,0,10-06-2003,BBC Audiobooks,
The Lovely Bones,1238,"The Lovely Bones is the story of a family devastated by a gruesome murder -- a murder recounted by the teenage victim. Upsetting, you say? Remarkably, first-time novelist Alice Sebold takes this difficult material and delivers a compelling and accomplished exploration of a fractured family's need for peace and closure.The details of the crime are laid out in the first few pages: from her vantage point in heaven, Susie Salmon describes how she was confronted by the murderer one December afternoon on her way home from school. Lured into an underground hiding place, she was raped and killed. But what the reader knows, her family does not. Anxiously, we keep vigil with Susie, aching for her grieving family, desperate for the killer to be found and punished.Sebold creates a heaven that's calm and comforting, a place whose residents can have whatever they enjoyed when they were alive -- and then some. But Susie isn't ready to release her hold on life just yet, and she intensely watches her family and friends as they struggle to cope with a reality in which she is no longer a part. To her great credit, Sebold has shaped one of the most loving and sympathetic fathers in contemporary literature.",,Alice Sebold,Non-Fiction,https://i.gr-assets.com/images/S/compressed.photo.goodreads.com/books/1457810586l/12232938.jpg,3.81,537,Alice Sebold,3.81,330485385,9.78E+12,en-GB,328,6485,966,06-01-2003,Picador,
The Magus,2306,"This daring literary thriller, rich with eroticism and suspense, is one of John Fowles's best-loved and bestselling novels and has contributed significantly to his international reputation as a writer of the first degree. At the center of The Magus is Nicholas Urfe, a young Englishman who accepts a teaching position on a remote Greek island, where he befriends a local millionaire. The friendship soon evolves into a deadly game, in which reality and fantasy are deliberately manipulated, and Nicholas finds that he must fight not only for his sanity but for his very survival.",,John Fowles,Non-Fiction,https://i.gr-assets.com/images/S/compressed.photo.goodreads.com/books/1441323311l/16286._SY475_.jpg,4.05,16286,John Fowles,4.05,316296198,9.78E+12,eng,656,38247,1915,01-04-2001,Back Bay Books,
The Maltese Falcon,1900,"Sam Spade is hired by the fragrant Miss Wonderley to track down her sister, who has eloped with a louse called Floyd Thursby. But Miss Wonderley is in fact the beautiful and treacherous Brigid O'Shaughnessy, and when Spade's partner Miles Archer is shot while on Thursby's trail, Spade finds himself both hunter and hunted: can he track down the jewel-encrusted bird, a treasure worth killing for, before the Fat Man finds him?",,Dashiell Hammett,Non-Fiction,https://i.gr-assets.com/images/S/compressed.photo.goodreads.com/books/1306421260l/29999._SY475_.jpg,3.91,29999,Dashiell Hammett,3.91,752865331,9.78E+12,eng,213,69254,2997,03-01-2005,Orion,
The Martian Chronicles,1711,"The strange and wonderful tale of man’s experiences on Mars, filled with intense images and astonishing visions. Now part of the Voyager Classics collection.The Martian Chronicles tells the story of humanity’s repeated attempts to colonize the red planet. The first men were few. Most succumbed to a disease they called the Great Loneliness when they saw their home planet dwindle to the size of a fist. They felt they had never been born. Those few that survived found no welcome on Mars. The shape-changing Martians thought they were native lunatics and duly locked them up.But more rockets arrived from Earth, and more, piercing the hallucinations projected by the Martians. People brought their old prejudices with them – and their desires and fantasies, tainted dreams. These were soon inhabited by the strange native beings, with their caged flowers and birds of flame.Contents:Rocket SummerYllaThe Summer NightThe Earth MenThe TaxpayerThe Third Expedition-And the Moon Be Still As BrightThe SettlersThe Green MorningThe LocustsNight MeetingThe ShoreInterimThe MusiciansWay in the Middle of the AirThe Naming of NamesUsher IIThe Old OnesThe MartianThe Luggage StoreThe Off SeasonThe WatchersThe Silent TownsThe Long YearsThere Will Come Soft RainsThe Million Year Picnic",,Ray Bradbury,Non-Fiction,https://i.gr-assets.com/images/S/compressed.photo.goodreads.com/books/1374049948l/76778.jpg,4.14,37444,Ray Bradbury/Ian  Miller,4.14,553011804,9.78E+12,eng,259,46,2,12-01-2006,Bantam Books,
The Master and Margarita,1443,"The first complete, annotated English Translation of Mikhail Bulgakov's comic masterpiece.An audacious revision of the stories of Faust and Pontius Pilate, The Master and Margarita is recognized as one of the essential classics of modern Russian literature. The novel's vision of Soviet life in the 1930s is so ferociously accurate that it could not be published during its author's lifetime and appeared only in a censored edition in the 1960s. Its truths are so enduring that its language has become part of the common Russian speech.One hot spring, the devil arrives in Moscow, accompanied by a retinue that includes a beautiful naked witch and an immense talking black cat with a fondness for chess and vodka. The visitors quickly wreak havoc in a city that refuses to believe in either God or Satan. But they also bring peace to two unhappy Muscovites: one is the Master, a writer pilloried for daring to write a novel about Christ and Pontius Pilate; the other is Margarita, who loves the Master so deeply that she is willing literally to go to hell for him. What ensues is a novel of in exhaustible energy, humor, and philosophical depth, a work whose nuances emerge for the first time in Diana Burgin's and Katherine Tiernan O'Connor's splendid English version.(back cover)",,Mikhail Bulgakov,Non-Fiction,https://i.gr-assets.com/images/S/compressed.photo.goodreads.com/books/1327867963l/117833.jpg,4.3,17828,Mikhail Bulgakov/Michael Karpelson,4.3,1411683056,9.78E+12,eng,332,493,47,04-01-2006,Lulu Press,
The Memory Keeper's Daughter,1449,"On a winter night in 1964, Dr. David Henry is forced by a blizzard to deliver his own twins. His son, born first, is perfectly healthy. Yet when his daughter is born, he sees immediately that she has Down's Syndrome. Rationalizing it as a need to protect Norah, his wife, he makes a split-second decision that will alter all of their lives forever. He asks his nurse to take the baby away to an institution and never to reveal the secret. But Caroline, the nurse, cannot leave the infant. Instead, she disappears into another city to raise the child herself. So begins this story that unfolds over a quarter of a century - in which these two families, ignorant of each other, are yet bound by the fateful decision made that long-ago winter night. Norah Henry, who knows only that her daughter died at birth, remains inconsolable; her grief weighs heavily on their marriage. And Paul, their son, raises himself as best he can, in a house grown cold with mourning. Meanwhile, Phoebe, the lost daughter, grows from a sunny child to a vibrant young woman whose mother loves her as fiercely as if she were her own.",,Kim Edwards,Non-Fiction,https://i.gr-assets.com/images/S/compressed.photo.goodreads.com/books/1552112312l/10441._SY475_.jpg,3.67,10441,Kim Edwards,3.67,143037145,9.78E+12,eng,401,535636,17550,5/30/2006,Penguin Books,
The Merchant of Venice,2339,"In this lively comedy of love and money in sixteenth-century Venice, Bassanio wants to impress the wealthy heiress Portia but lacks the necessary funds. He turns to his merchant friend, Antonio, who is forced to borrow from Shylock, a Jewish moneylender. When Antonio's business falters, repayment becomes impossible--and by the terms of the loan agreement, Shylock is able to demand a pound of Antonio's flesh. Portia cleverly intervenes, and all ends well (except of course for Shylock).",,William Shakespeare,Non-Fiction,https://i.gr-assets.com/images/S/compressed.photo.goodreads.com/books/1327871054l/24128.jpg,3.8,24136,William Shakespeare/Robert     Smith/Jonathan    Morris,3.8,521618754,9.78E+12,eng,196,1549,36,08-01-2005,Cambridge University Press,
The Mermaid Chair,2124,"An alternate cover edition exists here.Sue Monk Kidd's phenomenal debut, The Secret Life of Bees, became a runaway bestseller that is still on the New York Times bestseller list more than two years after its paperback publication. Now, in her luminous new novel, Kidd has woven a transcendent tale that will thrill her legion of fans. Telling the story of Jessie Sullivan -- a love story between a woman and a monk, a woman and her husband, and ultimately a woman and her own soul -- Kidd charts a journey of awakening and self-discovery illuminated with a brilliance that only a writer of her ability could conjure.",,Sue Monk Kidd,Non-Fiction,https://i.gr-assets.com/images/S/compressed.photo.goodreads.com/books/1533194482l/6976.jpg,3.13,6976,Sue Monk Kidd,3.13,143036696,9.78E+12,eng,368,68363,5816,03-07-2006,Penguin Books,
